{
  "schema_version": "stage1-mvp-v0",
  "task_id": "docops_ws_traceability_long_001",
  "task_type": "document_ops",
  "prompt": "Extract the explicit markdown links from the selected long-context source document without modifying any source file.",
  "initial_state": {
    "schema_version": "stage1-mvp-v0",
    "state_id": "state_docops_ws_traceability_long_001_initial",
    "task_id": "docops_ws_traceability_long_001",
    "task_intent": "Extract traceability links from a selected document in a multi-document context.",
    "objects": [
      {
        "object_id": "source_doc",
        "path": "inputs/source.md",
        "kind": "markdown"
      }
    ],
    "relations": [],
    "events": [],
    "uncertainty": {},
    "provenance": {
      "fixture": "docops_ws_traceability_long_001",
      "source": "phase5_working_set_fixture"
    },
    "state_hash": "sha256:fixture-initial"
  },
  "input_artifacts": [
    {
      "path": "inputs/noise.md",
      "role": "distractor",
      "description": "Long irrelevant trace segment."
    },
    {
      "path": "inputs/source.md",
      "role": "source",
      "description": "Selected markdown source containing explicit links."
    }
  ],
  "allowed_actions": [
    "validate_artifact"
  ],
  "success_criteria": [
    "All explicit markdown links in inputs/source.md are listed with label and target.",
    "No source file is modified.",
    "Evidence includes source path, file hash, and extracted link observations."
  ],
  "failure_criteria": [
    "A markdown link is omitted or fabricated.",
    "A source file is modified.",
    "Evidence lacks provenance for the source document."
  ],
  "side_effect_classes": [
    "READ_ONLY"
  ],
  "required_logs": [
    "canonical_state",
    "working_set",
    "execution_steps",
    "evidence_packets",
    "verifier_outputs",
    "episode_journal"
  ]
}
