{
  "schema_version": "stage1-mvp-v0",
  "task_id": "docops_ws_evidence_packet_001",
  "task_type": "document_ops",
  "prompt": "Validate that the selected Evidence Packet artifact exists and keep the action read-only.",
  "initial_state": {
    "schema_version": "stage1-mvp-v0",
    "state_id": "state_docops_ws_evidence_packet_001_initial",
    "task_id": "docops_ws_evidence_packet_001",
    "task_intent": "Validate an Evidence Packet artifact selected from long-context refs.",
    "objects": [
      {
        "object_id": "evidence_packet",
        "path": "inputs/evidence_packet.json",
        "kind": "json"
      }
    ],
    "relations": [],
    "events": [],
    "uncertainty": {},
    "provenance": {
      "fixture": "docops_ws_evidence_packet_001",
      "source": "phase5_working_set_fixture"
    },
    "state_hash": "sha256:fixture-initial"
  },
  "input_artifacts": [
    {
      "path": "inputs/noise.md",
      "role": "distractor",
      "description": "Irrelevant raw trace segment."
    },
    {
      "path": "inputs/evidence_packet.json",
      "role": "evidence",
      "description": "Selected Evidence Packet fixture artifact."
    }
  ],
  "allowed_actions": [
    "validate_artifact"
  ],
  "success_criteria": [
    "inputs/evidence_packet.json exists.",
    "No source file is modified.",
    "Evidence includes artifact path and file hash."
  ],
  "failure_criteria": [
    "The Evidence Packet artifact is not checked.",
    "A source file is modified.",
    "Evidence lacks provenance for the artifact."
  ],
  "side_effect_classes": [
    "READ_ONLY"
  ],
  "required_logs": [
    "canonical_state",
    "working_set",
    "execution_steps",
    "evidence_packets",
    "verifier_outputs",
    "episode_journal"
  ]
}
